{"budget":{"cost_microunits":{"available":{"status":"known","value":1000000},"estimated":{"status":"known","value":0},"policy_limit":{"maximum":null,"status":"unbounded"},"status":"within"},"duration_ms":{"available":{"status":"known","value":900000},"estimated":{"status":"known","value":1},"policy_limit":{"maximum":null,"status":"unbounded"},"status":"within"},"token_count":{"available":{"status":"known","value":100000},"estimated":{"status":"known","value":1},"policy_limit":{"maximum":null,"status":"unbounded"},"status":"within"}},"capability_downgrades":[],"context_digest":"sha256:63b5bc8b1ad56beaaa856c2cbbc49860e6fb7a82c1bb3be73570f094f9862d95","context_object_digest":"sha256:f0a3616ec4fe350109cf511bc674807333fbbf02ace631c4f3ae0ae0cb888d18","decision":"selected","evidence_plans":[],"manifest":{"asset_set_digest":"sha256:dd2a7eb389722cbe7f880f198917b630839311e98c044e76ae69efcccb618de2","manifest_digest":"sha256:44c1ab664588a862014aa18fb309f2dbcedb09ee1d8fbac7b87f026153e636d0","portfolio_id":"ask.portfolio.prompt-v2.claude","revision":"prompt-v2-challenger-v1"},"object_kind":"portfolio_selection","omitted_assets":[],"portfolio_lock":{"lock_digest":"sha256:a55df8da4f5dc8250c461f3872385580356ffbf0cd9ab8e51dad2ff95f7d95d8","lock_revision":3},"reasons":[],"registry":{"registry_id":"ask-local-assets","snapshot_digest":"sha256:fd6a82bb2685fbcb4a394613d8a2521ab91b1b7e9f75cfdb7621c712f52f8173","snapshot_revision":11},"rollback_target":{"asset_set_digest":"sha256:292855fbc1d7819a404e75b2a4584fbf9003179495a128df7707008a59025239","manifest_digest":"sha256:9c6c3c7992277baa653e58a316b9add80311f905001555a1d19a2e8b11b333da","portfolio_id":"ask.portfolio.prompt-v2.claude","revision":"prompt-v2-baseline-v1"},"schema_version":"1.0.0","selected_assets":[{"asset":{"asset_type":"prompt","content_digest":"sha256:e9081721770a65e5626afc648dc76f06b4069be92f015a24da21347a6f43a465","record_digest":"sha256:061bc45dbab12ef756f3054352b599a00d4b789cefb4c1e71d3892d1bf5fc118","stable_id":"ask.prompt-bundle.claude","version":"234.0.0-prompt-v2"},"assurance_lane":"exploratory","entry_id":"claude-challenger-prompt-bundle","exposure":{"canary_percent":null,"mode":"shadow"},"role":"experimental"}],"selection_digest":"sha256:1e2161d6826dcf170a3494bca78190132f93d3080ba29f544c3e94f90d5cc715","selection_phase":"pre_result"}
