{"budget":{"cost_microunits":{"available":{"status":"known","value":1000000},"estimated":{"status":"known","value":0},"policy_limit":{"maximum":null,"status":"unbounded"},"status":"within"},"duration_ms":{"available":{"status":"known","value":900000},"estimated":{"status":"known","value":1},"policy_limit":{"maximum":null,"status":"unbounded"},"status":"within"},"token_count":{"available":{"status":"known","value":100000},"estimated":{"status":"known","value":1},"policy_limit":{"maximum":null,"status":"unbounded"},"status":"within"}},"capability_downgrades":[],"context_digest":"sha256:53833403b5b0def35cc6572a5e19ead094bf1efca9331352bead4caba699da0e","context_object_digest":"sha256:41f883343635e3048fb02145019d3afa0d87d81b6b661b448d578acd03d47084","decision":"selected","evidence_plans":[],"manifest":{"asset_set_digest":"sha256:683f6c70f79d1fe4f63bb0480e1ab6e3c963323819e58b3ed9a85af8d4c9961c","manifest_digest":"sha256:46e3541f78aae65223dad8779164ad227e2c388a906ba52ea72cf99b76e99641","portfolio_id":"ask.portfolio.prompt-v2.claude","revision":"prompt-v2-baseline-v1"},"object_kind":"portfolio_selection","omitted_assets":[],"portfolio_lock":{"lock_digest":"sha256:24cc391f26cb4e1d6ccb2ed995333b44bec57f251b1bcc71de1d0d90064eafc7","lock_revision":2},"reasons":[],"registry":{"registry_id":"ask-local-assets","snapshot_digest":"sha256:d4f1962245e57fdbadf098dc959f49130e7f97ecb888d13d306a82338df05bfa","snapshot_revision":11},"rollback_target":null,"schema_version":"1.0.0","selected_assets":[{"asset":{"asset_type":"prompt","content_digest":"sha256:7ace0455dcd2e36caa87eecd5ef6cff0bf3f9265c33b445c4bf2f37241a3619e","record_digest":"sha256:0c23fd8c7aa03e146535e2ed5735a1ec2c0123784ac45a05a2d157733e081fc1","stable_id":"ask.prompt-bundle.claude","version":"234.0.0-current"},"assurance_lane":"exploratory","entry_id":"claude-baseline-prompt-bundle","exposure":{"canary_percent":null,"mode":"shadow"},"role":"experimental"}],"selection_digest":"sha256:92a8565fe347835af936ae7ac085109cb6cbebee81cd9a962643281a30951d05","selection_phase":"pre_result"}
