{"budget":{"cost_microunits":{"available":{"status":"known","value":1000},"estimated":{"status":"known","value":10},"policy_limit":{"maximum":null,"status":"unbounded"},"status":"within"},"duration_ms":{"available":{"status":"known","value":1000},"estimated":{"status":"known","value":10},"policy_limit":{"maximum":null,"status":"unbounded"},"status":"within"},"token_count":{"available":{"status":"known","value":1000},"estimated":{"status":"known","value":10},"policy_limit":{"maximum":null,"status":"unbounded"},"status":"within"}},"capability_downgrades":[],"context_digest":"sha256:6b2854eefcdd3e75d395440a65208c355347c2eb9ed8340c768b07fc79fcc4a3","context_object_digest":"sha256:1483d28b0ef0383705e012ada135fdc8dd1074256587d737f02adfa4e70c7e72","decision":"selected","evidence_plans":[],"manifest":{"asset_set_digest":"sha256:06ef54d6a0516d07d2b058a08b8a291d37f8e884bdb2ba6a924661776e8fb460","manifest_digest":"sha256:f7be1b013f6e96041848e63388aeba6e72786f3dcb31cc9f21b0282a3e01aa21","portfolio_id":"ask.portfolio.issue278.sample-runtime","revision":"sample-baseline-v1"},"object_kind":"portfolio_selection","omitted_assets":[],"portfolio_lock":{"lock_digest":"sha256:c156f2106ecabd6a0275d519d6b31237850fbfd21103c5ed766314294b3367f0","lock_revision":2},"reasons":[],"registry":{"registry_id":"ask-local-assets","snapshot_digest":"sha256:bed19f2c11e147262fb211ff162c590834f1f1d5f40f66b8e0a12e1caed4f801","snapshot_revision":6},"rollback_target":null,"schema_version":"1.0.0","selected_assets":[{"asset":{"asset_type":"prompt","content_digest":"sha256:c619c6c426da2f6fac9185c2426908ea83ff1598e5e9af7add61f509678a5853","record_digest":"sha256:0f2b5008f5f83d51ab93e5c93c2902731d0fdecead3e4ae6fa9bf61ae972f80f","stable_id":"ask.prompt-template.issue278.evolution-sample","version":"278.0.0-baseline"},"assurance_lane":"exploratory","entry_id":"sample-baseline-prompt","exposure":{"canary_percent":null,"mode":"shadow"},"role":"experimental"}],"selection_digest":"sha256:9e09842f67ffa8a487b08b2df109f260360eb7946247ebbf37de639e318542bc","selection_phase":"pre_result"}
