{"budget":{"cost_microunits":{"available":{"status":"known","value":1000000},"estimated":{"status":"known","value":0},"policy_limit":{"maximum":null,"status":"unbounded"},"status":"within"},"duration_ms":{"available":{"status":"known","value":900000},"estimated":{"status":"known","value":1},"policy_limit":{"maximum":null,"status":"unbounded"},"status":"within"},"token_count":{"available":{"status":"known","value":100000},"estimated":{"status":"known","value":1},"policy_limit":{"maximum":null,"status":"unbounded"},"status":"within"}},"capability_downgrades":[],"context_digest":"sha256:a8cde40f5452c6ed43ddc7f5a98297ed3587c7598d51d7f2a562383b7aaec1bd","context_object_digest":"sha256:36c7d798820dae3618f13fa823372d6ece26176ac6c426dd81cd9a987b11ebcc","decision":"selected","evidence_plans":[],"manifest":{"asset_set_digest":"sha256:3e3c9e0b02c3d27d9d1ee14c13d97d509557ad750b57b3d77b05e171abc68906","manifest_digest":"sha256:d0ad457d0673caadce455e185795e71b25ba0aeb2e256e3ab0998e36db0b07bb","portfolio_id":"ask.portfolio.prompt-v2.codex","revision":"prompt-v2-challenger-v1"},"object_kind":"portfolio_selection","omitted_assets":[],"portfolio_lock":{"lock_digest":"sha256:8beded452d55299ce90fd1b742611dd789b3d29c2f4f16443e27a54abece5510","lock_revision":3},"reasons":[],"registry":{"registry_id":"ask-local-assets","snapshot_digest":"sha256:d4f1962245e57fdbadf098dc959f49130e7f97ecb888d13d306a82338df05bfa","snapshot_revision":11},"rollback_target":{"asset_set_digest":"sha256:346873c682a7f2168407145e68f6cbfe36840adb1e656924c809e10fde03fdfa","manifest_digest":"sha256:6194e7a893316b18d9a0576ebf237f4ea15b24f1d19a716f5be88ad69f704e89","portfolio_id":"ask.portfolio.prompt-v2.codex","revision":"prompt-v2-baseline-v1"},"schema_version":"1.0.0","selected_assets":[{"asset":{"asset_type":"prompt","content_digest":"sha256:93c421e03879eb4a4b9ee62e6e9fb596045f16638b983d1941b450e418509949","record_digest":"sha256:36f9b3b20a946aacb840e031c1b0d2cb87e0ab4f6e913aa877ea4bdca4cc52b2","stable_id":"ask.prompt-bundle.codex","version":"234.0.0-prompt-v2"},"assurance_lane":"exploratory","entry_id":"codex-challenger-prompt-bundle","exposure":{"canary_percent":null,"mode":"shadow"},"role":"experimental"}],"selection_digest":"sha256:a86f3441b5ec699ba12b739ad44396117ddb9d215ef94bfa1792db17ad08c1f9","selection_phase":"pre_result"}
