{"budget":{"cost_microunits":{"available":{"status":"known","value":1000},"estimated":{"status":"known","value":10},"policy_limit":{"maximum":null,"status":"unbounded"},"status":"within"},"duration_ms":{"available":{"status":"known","value":1000},"estimated":{"status":"known","value":10},"policy_limit":{"maximum":null,"status":"unbounded"},"status":"within"},"token_count":{"available":{"status":"known","value":1000},"estimated":{"status":"known","value":10},"policy_limit":{"maximum":null,"status":"unbounded"},"status":"within"}},"capability_downgrades":[],"context_digest":"sha256:f00bbf810675bc00daf34930a609519aba1816cd04326f98a5d71279323f8167","context_object_digest":"sha256:e35e1cccee4ebb93ab332c8eb5537ef8377fdae30039f75f0d88a06e72f8f932","decision":"selected","evidence_plans":[],"manifest":{"asset_set_digest":"sha256:2e39061606b95f53b482e4aedf368f555d5e5be3f4a63eddc19e81e87006f963","manifest_digest":"sha256:f43c5fcd36120e7b4b33219a5d3b0dcd217c2ecf1e598d4b4c7811a51eaa5ec4","portfolio_id":"ask.portfolio.issue278.sample-evaluation","revision":"sample-challenger-v1"},"object_kind":"portfolio_selection","omitted_assets":[],"portfolio_lock":{"lock_digest":"sha256:3f25ba2955ccc1562fd1611da035c81eaef5eab85998ce43f65e99c8e463428c","lock_revision":2},"reasons":[],"registry":{"registry_id":"ask-local-assets","snapshot_digest":"sha256:bed19f2c11e147262fb211ff162c590834f1f1d5f40f66b8e0a12e1caed4f801","snapshot_revision":6},"rollback_target":null,"schema_version":"1.0.0","selected_assets":[{"asset":{"asset_type":"prompt","content_digest":"sha256:d89ac64c6b863068939aef479e324542c9b9c0150d3d37373467d81d6d7bcc84","record_digest":"sha256:9c93cb116df6bf61e855fc8d24fd26116acedbceaabae9a8b8d7fb5185ab6d78","stable_id":"ask.prompt-template.issue278.evolution-sample","version":"278.0.0-candidate"},"assurance_lane":"exploratory","entry_id":"sample-challenger-prompt","exposure":{"canary_percent":null,"mode":"shadow"},"role":"experimental"}],"selection_digest":"sha256:ce4a319b1020ee9b6fa783045683293692f10a6c8cb93e7742ce6af9003941ec","selection_phase":"pre_result"}
