{"budget":{"cost_microunits":{"available":{"status":"known","value":1000000},"estimated":{"status":"known","value":0},"policy_limit":{"maximum":null,"status":"unbounded"},"status":"within"},"duration_ms":{"available":{"status":"known","value":900000},"estimated":{"status":"known","value":1},"policy_limit":{"maximum":null,"status":"unbounded"},"status":"within"},"token_count":{"available":{"status":"known","value":100000},"estimated":{"status":"known","value":1},"policy_limit":{"maximum":null,"status":"unbounded"},"status":"within"}},"capability_downgrades":[],"context_digest":"sha256:74386c844f7e59919c6ee89b6959d4dc271cb50a7afc444e6b6467e55ceb47a4","context_object_digest":"sha256:e8f1e67bca2d3231d53ec4059e4e855fc1fb1882acef91894d64b04097cbc097","decision":"selected","evidence_plans":[],"manifest":{"asset_set_digest":"sha256:f2ed4f5c784cd8778324b1eaab970fa2ea351785a89e9957cb3c318fed307adc","manifest_digest":"sha256:26e381a5556797020944346b7c92722c9991913febe189f182119fceb8d1ff07","portfolio_id":"ask.portfolio.prompt-v2.claude","revision":"prompt-v2-challenger-v1"},"object_kind":"portfolio_selection","omitted_assets":[],"portfolio_lock":{"lock_digest":"sha256:140c1038e0db1a1ae65162f2e2f5c92549ede0f2c349bce2337380eea5ce85b8","lock_revision":3},"reasons":[],"registry":{"registry_id":"ask-local-assets","snapshot_digest":"sha256:d4f1962245e57fdbadf098dc959f49130e7f97ecb888d13d306a82338df05bfa","snapshot_revision":11},"rollback_target":{"asset_set_digest":"sha256:683f6c70f79d1fe4f63bb0480e1ab6e3c963323819e58b3ed9a85af8d4c9961c","manifest_digest":"sha256:56d938ec3d9e474c614670fd92cb4559eba7cd17f7f060a4a74cae892ee6ff8e","portfolio_id":"ask.portfolio.prompt-v2.claude","revision":"prompt-v2-baseline-v1"},"schema_version":"1.0.0","selected_assets":[{"asset":{"asset_type":"prompt","content_digest":"sha256:42f463a383ede4690b0ed9dc0925388a9cc2f6d7cec944932d07e25103423f59","record_digest":"sha256:5ea73fbbe3ca75707c8328a5d2fe5723c94f681db67c528b35d33b501cd44e4a","stable_id":"ask.prompt-bundle.claude","version":"234.0.0-prompt-v2"},"assurance_lane":"exploratory","entry_id":"claude-challenger-prompt-bundle","exposure":{"canary_percent":null,"mode":"shadow"},"role":"experimental"}],"selection_digest":"sha256:0820c32e0f813bcea4ed21cc5f9eb6be404b492208991036cabb77c7171014f6","selection_phase":"pre_result"}
