{"budget":{"cost_microunits":{"available":{"status":"known","value":1000000},"estimated":{"status":"known","value":0},"policy_limit":{"maximum":null,"status":"unbounded"},"status":"within"},"duration_ms":{"available":{"status":"known","value":900000},"estimated":{"status":"known","value":1},"policy_limit":{"maximum":null,"status":"unbounded"},"status":"within"},"token_count":{"available":{"status":"known","value":100000},"estimated":{"status":"known","value":1},"policy_limit":{"maximum":null,"status":"unbounded"},"status":"within"}},"capability_downgrades":[],"context_digest":"sha256:ff4c17fb676cb290fa7ff53aac8e0235a1e92679c17e95790b0342a43e32d8f5","context_object_digest":"sha256:25de3a0e6d1d729733ad8703e6032344df2f0ee09b4c774ba08986d7cb5f1c76","decision":"selected","evidence_plans":[],"manifest":{"asset_set_digest":"sha256:683f6c70f79d1fe4f63bb0480e1ab6e3c963323819e58b3ed9a85af8d4c9961c","manifest_digest":"sha256:56d938ec3d9e474c614670fd92cb4559eba7cd17f7f060a4a74cae892ee6ff8e","portfolio_id":"ask.portfolio.prompt-v2.claude","revision":"prompt-v2-baseline-v1"},"object_kind":"portfolio_selection","omitted_assets":[],"portfolio_lock":{"lock_digest":"sha256:eee4b853c63f8fd50602ceccaf684e0565f5b88e2fec58ed9ad98b9609a419b0","lock_revision":2},"reasons":[],"registry":{"registry_id":"ask-local-assets","snapshot_digest":"sha256:d4f1962245e57fdbadf098dc959f49130e7f97ecb888d13d306a82338df05bfa","snapshot_revision":11},"rollback_target":null,"schema_version":"1.0.0","selected_assets":[{"asset":{"asset_type":"prompt","content_digest":"sha256:7ace0455dcd2e36caa87eecd5ef6cff0bf3f9265c33b445c4bf2f37241a3619e","record_digest":"sha256:0c23fd8c7aa03e146535e2ed5735a1ec2c0123784ac45a05a2d157733e081fc1","stable_id":"ask.prompt-bundle.claude","version":"234.0.0-current"},"assurance_lane":"exploratory","entry_id":"claude-baseline-prompt-bundle","exposure":{"canary_percent":null,"mode":"shadow"},"role":"experimental"}],"selection_digest":"sha256:9d5022b7c015d6d3baf05baf770dabd9957a95fac18234883d497ef795ffdd8d","selection_phase":"pre_result"}
