{"budget":{"cost_microunits":{"available":{"status":"known","value":1000},"estimated":{"status":"known","value":10},"policy_limit":{"maximum":null,"status":"unbounded"},"status":"within"},"duration_ms":{"available":{"status":"known","value":1000},"estimated":{"status":"known","value":10},"policy_limit":{"maximum":null,"status":"unbounded"},"status":"within"},"token_count":{"available":{"status":"known","value":1000},"estimated":{"status":"known","value":10},"policy_limit":{"maximum":null,"status":"unbounded"},"status":"within"}},"capability_downgrades":[],"context_digest":"sha256:093c5023e59b010414f61a3d283bb9f7ae1dabe65871134171c5d07ba49c3eaa","context_object_digest":"sha256:6fa9ad532e3f7edf0032db7cac0c99523a89cafdda98ed7d260c73b303539eef","decision":"selected","evidence_plans":[],"manifest":{"asset_set_digest":"sha256:2e39061606b95f53b482e4aedf368f555d5e5be3f4a63eddc19e81e87006f963","manifest_digest":"sha256:2b9550fef6878114702bf2b318f9e6b02460694e8b295b148dc77a054a5aff6d","portfolio_id":"ask.portfolio.issue278.sample-evaluation","revision":"sample-challenger-v1"},"object_kind":"portfolio_selection","omitted_assets":[],"portfolio_lock":{"lock_digest":"sha256:e9b0c0320e2181568b838261a37946a6861ba96b414e4304cac4b643be3f297a","lock_revision":2},"reasons":[],"registry":{"registry_id":"ask-local-assets","snapshot_digest":"sha256:679ecc1a1507a3663a97d45fb8152acef0ec547fe39b37a12a6345227533dca7","snapshot_revision":8},"rollback_target":null,"schema_version":"1.0.0","selected_assets":[{"asset":{"asset_type":"prompt","content_digest":"sha256:d89ac64c6b863068939aef479e324542c9b9c0150d3d37373467d81d6d7bcc84","record_digest":"sha256:9c93cb116df6bf61e855fc8d24fd26116acedbceaabae9a8b8d7fb5185ab6d78","stable_id":"ask.prompt-template.issue278.evolution-sample","version":"278.0.0-candidate"},"assurance_lane":"exploratory","entry_id":"sample-challenger-prompt","exposure":{"canary_percent":null,"mode":"shadow"},"role":"experimental"}],"selection_digest":"sha256:d7dbe4e669c848d6e9f653094ebed57fabd8e394cd695c3d124bf2ec574a9244","selection_phase":"pre_result"}
